diary,emotion
"나는 애니메이션 영화를 좋아한다. 어른이면서 애니메이션 영화를 좋아하냐는 사람도 있지만 무슨 상관일까. 내가 애니메이션 영화를 좋아하는 것은 어릴 때부터 디즈니와 같은 다양한 만화영화를 보여주신 부모님의 영향이 클 것이다. 기억에 남아 있는 애니메이션은 흙꼭두장군, 은비까비, 천녀유혼과 같은 것들이다. 재미 있는 영화가 많았다. 영화의 내용은 생각이 나지만 제목은 기억이 나지 않는 것도 많다. 지금 다시 보고 싶지만 어떻게 찾아야할 지 막막하다.",3
제가 밤을 새서 열심히 공부를 한 것은 아닙니다...,3
오늘은 2020년 2월 28일 내가 내 가슴속 감기와 싸우기 시작한지 어느덧 3년이 지나는 날이다. 처음 시작은 초등학교 4학년 그 아이들을 만나고 부터 였다. 친구라고 생각했던 아이들이 나에게서 등을 돌리기 시작했을때 나에게 폭력이 시작 되었을때 처음에는 그저 믿기지 않았다 그 아이들이 그럴리 없다고 다 내 잘못일거라고 내 탓만 했다 내가 아무리 노력하고 노력해도 상황은 바뀌지 않는다는걸 알게되었을땐 이미 내 마음의 감기는 지독했었다 그렇게 중학교까지 5년간의 괴롭힘 끝에 전학을 갈 수 있게되었고 나는 도망을 선택했다 모든것은 다 내 잘못이라고 생각했기에 몸에 흉터가 늘고 마음에도 흉터가 생기고 사람들조차 무서워 졌음에도 나는 침묵을 택했다 그런 나로 인해 가족과의 관계에서도 회의를 느끼기 시작했고 모든 사람들이 무서워지기 시작했다 나만에 세계에서 나 혼자 살아가길 바라고 또 바랬다 그렇게 새로운 학교에서 어영부영 일년을 보내고 입학한 고등학교 1학년 나는 자살을 택했다. 내 옆엔 아무도 없고 나는 이 세상에 아무 쓸모가 없다고 생각했기에 난 죽음을 택했다. 하지만 죽음에 문턱에서도 난 겁쟁이였다. 결국 부모님이 나의 상태를 알게되셨고 난 정신병원에 가게되었다. 처음에는 이런 곳에 온다고 나아질 마음이였으면 죽겠다는 생각도 하지 않았을 거라며 거부했지만 억지로 한번 두번 상담선생님과 이야기하고 나의 과거를 털어놓으며 그 모든것들은 나의 잘못이 아니라 그저 그 아이들의 희생양이 되었을 뿐이라고 너에게는 잘못이 없다고 말씀하시는 선생님의 이야기를 들으며 계속해서 억압했던 나 자신을 풀어줄 수 있게 되었다. 약을 먹으며 자살충동과 자해 공황장애 불안장애를 조절하기 시작했고 3년간 치료를 하면서 정말 힘들고 포기하고 싶을때도 많았지만 결국 2020년 완치는 아니지만 나의 의지를 컨트롤 할 수 있게 되었다. 나 처럼 세상을 하루하루 힘들게 살아가는 친구들에게 꼭 해주고 싶은 이야기가 있었다. 너의 잘못이 아니라고 그저 자연적인 재해였다고 내가 피할수도 없는 세상의 누군가는 함께 겪고있을 그런 것이라고 넌 이겨낼수 있다고. 나처럼.,3
"이게 내가 지금 일기를 쓰게 된 이유이다. 왜 그렇게 술마시면 사연있는 것 처럼 굴까. 그래놓고 뭐라 말하는 것도 아니고 눈빛을 보내는 건뭐야.  뜬금 없지만 이 상황이 약간 아빠랑 오빠가 싸우는 패턴이랑 비슷하다. 진짜 싸울때 마다 느끼는 건데 둘 성향 모두 맘에 들지 않는다. 분노조절장애 있는 것처럼 불같이 화내는 오빠도 오빤데, 혼자서 참다참다가 말을 하는 아빠도 진짜 아니다. 약간 자기가 참는 것이 남을 위한 거고 자기가 배려하고 있다는 생각, 그러니까 자신이 침묵하는 피해자 인 것 처럼 구는 마음이 없지않다고 생각한다. 그래서 이렇게 참는 유형도 남 입장을 잘 생각안하고 자기만 생각한다. 아빠가 딱 그렇다.",3
내일은 나쁜 아빠를 잡지 말아야겠어! WICKED KING(wicked=사악한 king=왕),3
제목:아니 어째 이런일이!,3
난 코로나19가 왜 갑자기 나타났는지 잘 모른다. 어디서 나타난 바이러스일까?,3
어릴때부터 공부를 해와서 지금은 공부를 안하면 뭘 해야하는지조차 잘 모르겠다.,3
"겨울방학이 시작된지 6주가 지났다. 방학 후의 일상은 평소 학교를 다닐 때와 크게 다르지 않다. 학원을 매일 가기 때문에  등교시간이 늦춰진 학교를 다니는 기분이다. 방학을 하고 나서 느낀 고민은 학원에서 하는 방학 특강이 힘들다는 것이다. 이번에 학원에서 하는 방학 특강은 수학, 영어, 국어를 듣는다.",3
나는 학생증을 체크카드와 후불 교통카드로 쓰고있었고 지갑없이 그 카드만 가져왔기에 잃어버렸다는걸 깨달았을때 나중에 집에 어떻게 가야할지 살짝 막막하게 느껴졌다.,3
너무 고통스러워 병원에 갔더니 무조건 휴식하란다,3
오늘은 코로나 바이러스에 대해서를 할거다. 코로나 바이러스는 위험 하다.코로나 바이러스에 걸리면 처음에는 열이 않나다가 열이 난다. 코로나 바이러스에 걸리면 죽은 사람도 있다.안죽을 수도 있다.나는 코로나 바이러스가 없어졌으면 좋겠다. 그래서 아주 건강하게 살았으면 좋겠다. 오늘은 마스크가 불편 했다.,3
맵을 둘러보고 있는데 이 npc가 나한테 게임상에서 전화를 해서 '집에서 나오지마렴'하는데다가 집에 지하실이 있는데 지하실 절대 못들어가게 하길래 불신과 의심은 깊어져만 갔다.,3
A는 나와 도가 지나친 장난을 치면서 놀았다. 그러던중 A가 외모로 나를 심하게 놀려 참다 못해 A를 무시 했다. A는 미안하다고 했지만 나는 아무 말도 하지 않았다. 순간적으로 화는 났지만 오래가지 않고 금방 마음이 풀렸다. 하지만 A는 내가 화가 많이 났다고 생각했나보다.,3
답답함 마음에 동료들과 점심을 먹으며 조심스레 아침에 있었던 일을 털어놓았다. 왜 이렇게 화가 나고 계속 생각이 나는지 이해가 가지 않는다고... 그랬더니 한 분이 귀여운 고백을 해주셨다.,3
푹자야키도크는데,3
아직 공모전 스케치도 다 못했는데... 마감이 다가오고 있다...,3
점점 쫓기는 기분이다.,3
"요즘 클라리넷 학원을 자주 간다. 9월 9일에 큰 연주회가 있기 때문이다. 월, 화, 수, 목으로 가서 세게 연습한다. 난 현재 3곡을 하고 있다. 3시에 가서 연습 준비를 하고 있는데, 선생님이 새 악보를 주셨다. 원래 있던 라데츠키 행진곡에 새 부분이 추가된 것인데, 때문에 행진곡이 무척이나 길어졌다. 거기다 첫 연습이라 그 새로운 부분은 많이 삐걱댔다. 그래서 혼나가면서 열심히 연습했다. 그래도 나름 느낌은 났다. 어서 잘하게 돼야 할텐데...",3
순조롭게 수행평가를 마치겠다는 생각을 했다. 현장체험을 다녀온 바로 다음 날이 과제 제출날인걸 나는 까먹고 있었다. 급하게 B에게 연락을 해 다 끝냈냐고 물어봤지만 돌아오는 답은 없었다.,3
나 같은 사람한테 얼마나 열등감을 느끼면 저런 소리를 할까. 그냥 무시하는 게 편하다 이제는...,3
나를 까고있는 친척들이 넘나 싫은것.ㅗㅗㅗㅗ,3
"기분이 나빠진 건 별 이유가 아니었다. 그냥 눈을 떴을 뿐이다. 오늘은 유난히 커튼 틈으로 들어오는 햇빛이 싫었고 그래서 다시 이불을 뒤집어 썼다. 내 이불은 할머니가 목화솜으로 만들어 준 도톰한 솜이불에 그리드 패턴의 커버를 씌웠다. 워낙 두꺼운지라 금방 숨이 막혔다. 이 겨울에 콧등에 땀이 맺히기에 눈을 감고 이불을 젖혔다. 갑자기 닿아오는 찬기운 탓에 크게 재채기가 났다. 옆에서 곤히 자던 강아지가 화들짝 놀래며 일어났다. 미안했다. 더 자라고 소근거리며 목덜미를 긁어주자 강아지가 다시 자리를 잡고 엎어졌다. 오늘 해야 할 일을 생각했다. 어제와 똑같았다. 준비하는 시험이 있어 더 꾸물거리지 말고 일어나야 했다. 매일매일 계획을 쓰지만 한 번도 완벽하게 마무리 한적 없다. 오늘처럼 게으른 탓이다. 나는 그걸 알고 있으면서도 좀처럼 움직일 수 없었다. 오늘은 좀 쉴까. 그래도 어제는 꽤 공부 했으니까. 그런 생각이 들자 몸이 더 무거워졌다. 오늘은 쉬자. 결심했다. 다시 이불을 덮었고 기분은 더더욱 가라앉았다. 아무것도 할 줄 모르는 사람이 된 것 같았다. 사실 맞다.  나는 고작 침대에서 벗어나지도 못하는 사람이다. 몸이 힘들면 마음이 편하다는 말을 나는 매일 실감한다. 해야할 게 있을 때는 더더욱 그렇다. 나는 오늘도 하기 싫어 포기했지만, 마음은 내내 불안할 게 분명하다. 우스운 것은 그걸 알면서도 반복하고 있다는 점이다. 나는 나를 제법 객관적으로 파악할 줄 알았다. 약점과 강점을 알고 좋아하는 것 싫어하는 것을 알며 나쁜 습관과 좋은 습관을 안다. 그리고 내가 아는 나의 가장 나쁜 점은 알면서도 바꾸지 않는 점이다. 이 일기를 쓰고 있으면서도, 문제점을 알면서도 나는 또 제자리를 걷고 있다. 제자리면 다행이다. 내리막길이다. 남들은 도대체 어떻게 해야할 일을 할 수 있는지 궁금하다. 다들 하는 그걸 나는 왜 못하는지도 궁금하다. 이대로 침대에서 움직이고 싶지 않지만, 그렇게 했다간 오늘 하루 끝에 신랄하게 나를 비판하며 자책할 나를 알기에 일어나 아침을 먹기로 했다. 아침부터 길고 긴 생각의 결론은 고작 그거다. 아침을 먹어야 한다는 것. 아침을 먹고 나면 해야할 일을 해야겠다는 생각이 들었으면 좋겠다. 오늘 쉬고 싶지 않다.",3
"내일 미리로 갈 버스 타는 장소를 확인하고 엠파이어호텔을 가기 위해 버스터미널을 찾았다. 이렇게 부유한 나라에서 협소하고 구석진 곳에 필요한 시설도 제대로 갖추지 않는 것이 이해하기 어려웠다. 지저분하고 냄새가 날 거 같은 화장실에서도 이용료를 받고 있었다. 버스를 기다릴 만한 장소도 없고 쉴 수 있는 의자도 없다. 매연이 뿜어 나오는 자동차와 시끄러운 소음 속에 서서 언제 올지 모를 버스를 기다려야 했다. 30분 후에 작은 미니버스는 7명을 태우고 출발했다. 도심에서 나와 자연이 있는 숲을 보니 숨통이 트이는 듯하다. 잘 정리된 마을을 들러 사람들을 하나 둘씩 내리고 나니 차 안에는 혼자가 되었다. 시원한 바닷가를 따라 숲길을 달리는 버스 여행에 절로 힘이 난다. 인간의 힘으로 자연에서 최고로 좋은 것만 모아서 만들어 놓은 듯한 풍광이 눈앞에 펼쳐진다. 호텔 바로 앞에 끝없이 펼쳐 있는 해변이 엠파이어 호텔을 한층 빛나게 한다. 중간 중간에 만들어 놓은 수영장은 해변과 조화를 이루어 한층 빛을 발한다. 브루나이를 대표하는 탄중바투 해변은 로맨틱한 감성이 뿜어져 나오는 일몰로 유명한 해변이다. 해안을 보호하기 위해 만들어진 방파제 위에 산책로와 낚시, 피크닉 등을 즐길 수 있게 꾸며 놓아 여행의 여유를 한층 더 만끽할 수 있다.",3
"언니라는 명칭은 꽤나 강압적인 단어가 아닐까 생각이 든다. 언니니까! 언니라서! 언니면서!  부모님의 말 하나하나가 동생에게는 당연히 다가오기 때문에 형제 족보가 꼬일 가능성이 높다. 족보라는 언어가 나를 단단한 꼰대로 보이게 만드는데 언니라는 단어의 힘에 비하면 우스운 수준이다. 이건 언니라는 명칭이 만든 이기심이니까 언니라는 것 때문에 감정의 흠집이 생겼다면 당연한 일이 된다. 눈에는 눈, 코에는 코. 배려에는 배려. 내가 언니라서 동생에게 배려를 해줬다면 그만큼의 배려를 받는게 마땅하다.  언니의 억울함을 가소롭게 생각하는 사람은 한번 당해봐야 정신을 차릴 인간들일테다. 내가 귀 뚫고 싶다고 엄마한테 부탁할 때는 안된다고, 뚫으면 집에서 _아낼 거라고 막 뭐라 하더니.. 동생이 6학년인지 5학년인지 뚫겠다고 하던 때(심지어 내가 부탈할 때 보다 더 어릴 때다!) 엄마는 쉽게 허락했다. 두발 자전거를 배울 때, 동생은 잘만 해줬으면서 나는 그 때 (애기 시절인데도 불구하고..!!)무겁다고 안 가르쳐줬다. 나는 그게 너무 분하고 억울하고 짜증났다. 지금도 여전히 같은 감정이다. 동생의 안좋은 버릇은 전부 언니 때문인냥 구는 것도 퍽이나 보기 흥미진진해서 기분이 나쁘기보단 빈정이 상한다. 진짜 좋은 건 나보다  먼저하면서 욕심은  하늘을 찌를 듯한게 짜증나 심장에 폭탄이 터져 죽을 것 같다. 언니가 있는 사람들은 진지해야한다. 신중해야하고, 언니의 조언을 개 짖는 소리 듣 듯 들으면 안된다. 경험담이라서 잘 안다.",3
'컴퓨터도 사고 싶다. 컴퓨터로 밤새 게임하고 싶다'라는 생각이 머릿속에 계속 맴돈다. 이대로 고등학교에 가면 공부에 집중할 수 있을지 모르겠다. 이제는 게임을 자제해야 한다는 것을 알지만 심심한 것은 해결할 수 없다. 심심해.,3
불행.,3
그럼에도 불구하고 어떻게든 여기까지 아둥바둥 살아온 나.,3
나는 입시의 노예다. 끝없는 시험과 수행평가 그리고 비교과 활동이 나의 숨통을 막히게 한다.,3
"이것이 지옥이 아니면 뭘까? 내가 나이가 들고 자아가 생기면서, 또, 이 세상을 십수년간 살아오면서 가장 힘들었던 것은 내가 힘이 없다는 사실이다. 이렇게 일기를 써봤자 세상은 전혀 나아지지 않고, 여전히 어린아이 여성 노인 난민,, 셀 수 없이 많은 사람들이 죽고있다.",3
"벌써 2월, 다들 오늘 하루를 어떻게 보냈을까? 어떤 사람은 나와 같은 행동을 하고 있을 수도 있고 열심히 공부하고 있을 수도 있고 다 나름의 일상들을 열심히 살아가고 있을 것이다. 나와 같은 또래의 친구들은 자기의 부족한 점을 바꾸기 위해 겨울방학동안 남들보다 열심히 공부를 하고 있겠지? 나는 2월은 1월보다 규칙적인 생활을 하기 위해 플래너를 쓰기 시작했다. 쓰면서 유명한 명언도 함께 썼는데 "" 당신이 참으로 '열심히' 산다면 '나중에' 라고 말하지 말고, 지금 당장 이 순간에 해야 할 일을 시작해야 한다."" - 괴테 이 명언을 쓰고 나서 나는 후회하지 않는 삶, 성공하기 위해서는 정말 할 일을 미루지 않고 그날그날 하고 지금 당장 그 일을 해야 한다. 라고 생각했다. 하지만 말은 정말 쉽다. 왜 항상 말은 쉬운데 직접 실천 하지 못 하는 걸까? 나도 안다. 나의 안 좋은 습관들과 휴대폰에 쉽게 유혹돼는 안 좋은 버릇들. 잠깐 공부에 집중했다가 휴대폰으로 검색하기 위해 잠깐 보면 항상 몇 시간은 그냥 흘러가는 것 같다. 그러다가 새벽에 못 한 것들은 하다가 늦게 자서 늦게 일어나서 엄마한테 꾸중을 듣고 하루가 짧아지고 수면 패턴이 다 무너져버렸다.",3
억지로 눈을 감고 잠을 자려 애를 써도 잠들기는커녕 신경만 더 곤두세워졌다. 이렇게 피곤한데 말짱한 정신이 괴로웠다. 억울했다. 내 우울을 조절하지 못하는 내가 못내 가여웠다.,3
돈없고 차없는 내가 잘 못인가 싶다.,3
"나아진 줄 알았는데 근래엔 무의식적으로 죽고싶다는 생각을 하게 된다. 그냥 눈을 감았다 뜨면서, 그 깜빡이는 찰나의 시간에 죽고싶고. 혼자 휴대폰을 만지작거리다, 문득 지루한데 죽어버릴까 싶고. 주변사람들에게 온 연락들을 보다 내가 죽으면 장례식에 와줄까 궁금증이 인다. 그러고나면 대학 동기들은 너무 멀어서 올 수 없을 것 같으니 마음으로라도 나를 위로해달라 해야겠다, 하는 생각. 누가 울까, 갈때 가더라도 친했던 사람들에게 편지 한 줄씩은 적고 가야지 싶은 마음. 그래봤자 죽지는 못 하는데. 죽지 않더라도. 이건 그냥 스쳐가는 계절일까, 고질적 잠식일까.",3
"20년 1월을 강타한 신종 코로나 바이러스 때문에 그동안 해왔던 강당 졸업식 대신 각자의 교실에서 방송을 통해 졸업식을 했는데, 춥지 않아서 좋긴 했지만 그래도 조금 아쉬웠다. 그래도 교복을 입는 마지막 졸업식인데...",3
나는 이제 고등학교 2학년이 된다. 그래서 학원에서 수학 1을 예습 하고 있다. 처음 배워보는 로그 때문에 골치가 아프다. 다른 친구들 보면 벌써 진도를 빨리 나가 수학 2까지 하던데 너무 걱정이다. 그래서 나도 나름 노력은 해보지만 내 뇌가 그렇게 쉽게 따라주지 않는다. 지금은 함수를 배우고 있는데 정말 머리가 터질 거 같다. 수포자만 안 되길 바라고 있다. 고3되면 수학이 훨씬 더 어려울텐데 내 목표는 인서울이 였지만 인서울은 무슨 내가 원하는 과라도 가고싶다. 올해는 시험 준비도 두달 전부터 해서 진짜 내신 관리 열심히 해볼거다,3
다른 사람들에게 인정을 받을 수 있을 정도로 완벽하게 할 수 있는지 확신이 들지 않았다.,3
"토요일에 영화 보러 만났는데 내가 팝콘이랑 콜라를 가지고 있다는 걸 알면서도(너무 급해서 몰랐으려나...) 바로 올라갔고, 바로는 아니더라도 전화해서 내가 밑에 있는 걸 알았다면 적어도 그때는 내려와 줬어야 하는 것 아니었을까. 그래서 화가 났다. 이것 때문에 밥먹을때까지 계속 무뚝뚝하게 있었는데 이건 내 잘못이지만 계속 말을 걸어서 미안하지만 지금은 말 할 기분이 아니라고 했는데도 계속 말을 걸더라. 어이가 없었고 여기서 내가 뭘 더 할 수 있을까라는 생각이 들어서 밥만 먹고 헤어지자는 생각으로 대충 대답했다. 그리고 버스에서 나도 모르게 눈물이 났는데 못 본 건지 못 본 척 했던건진 모르겠지만 페북 보여주고 카톡 보여주고 하더라. 후자였다면 진짜 너무 싫고 최악이다. 이게 진짜 뭐가 친구냐.. 혼밥 혼영화하기 싫어서 불러내는 애지 그냥... 내가 우울하고 무기력한거 어렵게 말하고 알려줬는데도 내가 그런 말 껄끄러워하는거 알면서 계속 나중에 뭐 보러가자, 하러가자, 여행가자 같은 이야기를 하고. 정말 내가 여기서 뭘 더 해야 하지? 억지로 웃으면서 밝게 맞장구쳐주면서 말하기? 나는 항상 최대한 신경써주고 내가 싫은소리 하게될 것 같으면 일부러 말하기를 피하고 시험 준비 힘든 거 아니까 해가 되게 하지 않으려고 했다. 하루하루 계속 힘들겠지 그래 다시 좋은 생각 하면서 마음을 담아서 편지도 쓰고, 며칠 전부터 선물도 준비했다. 작년에 나는 생일선물 받았었나...",3
쓰기 전에는 어떻게 이런 얼굴 로 살았을까 라는 생각이 들었다,3
엄마는잔소리 쟁이,3
정말 기가 막히고 코가 막히는 상황임에도,3
아무튼 나는 다가가서 따졌지.,3
혹시 나도 빛을 낼 수 있을까 작은 별이 될 수 있을까 눈 앞에 있는 전기줄을 모두 잘라 없애고 싶다. 그럼 작은 별빛도 볼 수 있을텐데,3
과학시 간에 뛰어다니다가 벽에부디쳐서 손가락이 아팠다. 보건실로가서 아이스 팩을 받아왔다. 아직도 손가락이쑤셨다. 그래서 손가락 에 플라스틱으로 만들어진 손을고정 해주는장치를 했다.,3
지금은밤 이다 난이제냥냥이들한테 간식을 줄시간이다처음이라냥이들이경계할까봐걱정된다그때마침 달콩이가왔다,3
3.1운동을 생각하면 유관순 열사를 생각한다. 그런데 유관순 열사 말고도 여러 인물들이 3.1운동에 참여했다. 그동안 나는 유관순 열사만 알고 있었다는 것이 조금 부끄러웠다.,3
이렇게 글을 쓰다가 도중에 시간이 날아가서 다 날아가 화가 난다.,3
우리가 잘 되어야 건물주도 좋을텐데 우리가게 포함 4군데 세입자는 서로 말만 할뿐 누구하나 건물주에게 말을 건네지 않는다.,3
젊은 사람들이 시장에 잘 안 가는 이유는 가격이 안 써있어서 같다. 전화 하는것도  힘들어하는 세대한테 가격을 묻고 원하는 가격이 아닐 때 흥정하거나 그냥 가는 건 너무 너무 너무 힘든 일일 것이다.,3
"나는 아직 학교에서의 수업을 따라가기도 벅차고 급급한데, 내가 나중에 나의 반이 된 아이들에게 좋은 교육을 할 수 있는 것 일까? 에 관한 의문도 생기고 또한 내가 책임지고 평생 이 직업으로 살 수 있을 지에 관한 의문도 든다, 이런 생각들로 인해서 자꾸 한 없이 우울감에 빠지고 무기력해지는 것 같다. 특히 잠에 들려고 눈을 감은 시점에서 가장 생각이 많이 드는 것 같다.",3
사람은 사람 없이 살 수 없게 태어난 생물이라는 말이 들었다. 내 모습이 딱 그 짝인 것 같다.,3
왜.,3
뭐 안놀았어도 그 시간에 공부를 하진 않았을 테니 후회는 없다,3
집에서 나오기 전에 공부로 인한 스트레스가 심했다. 그러나 공부는 할 수 밖에 없는 것이었고 살아오면서 할 줄 아는 것도 다른게 없었다. 그러면 무슨 문제를 일으켜야할까?어디로 눈을 돌려야 할까? 마침 나는 친구들과 매일 같이 학교 앞 편의점에서 간식을 사먹고 살이 쪄 있었다. 그렇다. 다이어트로 스트레스를 받는게 더 낫다고 생각했다.,3
"지나고나면 미안한 생각이 들지만 우울하다는 마음으로 방패를 삼고 나와 가장 가까운 혹은 꽤나 가까운 그와 그들에게 또 한번 예민한 행동을 하고만다. 민망함에 짧게나마 미안함을 표현하는 카톡을 남겨두지만 그것은 모든 생각을 다 표현하기에도 부족하고 일상을 바쁘게 지나던 상대에게도 아마 깊게 생각할 시간을 주기도 어려울 것이다. 그냥 처음부터 내가 요즘 너무 지친다, 내가 요즘 너무 힘들다 하고 털어놓고 이야기 했다면 좋았을까. 요즘따라 참 우울한 일들이 많다며 기댔다면 마음이 예민해지기 전에 풀어지지 않았을까. 아쉬운 생각이 든다. 내가 말하지 않으면 그도 알 수 없다는 사실을 다 알면서도  왜 그리도 가까운 그는 알아주지 않았는지, 왜 그는 나에게 좀 더 관심을 가져주지 않았는지 서운한 생각이 드는 건 어쩔 수가 없다. 참 사람의 마음다루기란 어려운 듯 하다. 생각으로 알고 납득이 가면서도 막상 마음이 따라주지 않아 행동도 생각과 다르게 일어날 때가 있다. 아니 참 많다는게 사실이다.",3
"아침부터 언니와 싸워서 하루의 시작이 기분 좋지 않았다. 내일은 교생 선생님께서 가시는 날이라서 오늘은 선생님과 전화번호와 SNS 아이디를 교환했고, 사진도 찍었다. 학교 끝날 때쯤에는 머리가 아파서 학원 상담과 학생회 일정도 미루고 집에 갔다. 오늘은 일이 원하는 대로 풀리지 않은 날 같다.",3
그 지루한걸 열심히 했던 나도 참 멋진것같다.,3
"세상에는 연기도 잘하고 범죄도 저지르지 않는 연기자들이 많이 있지만, 그럼에도 방송사는 계속해서 성범죄 전과가 있는, 또는 그 밖의 여러 범죄사실이 있는 연예인을 캐스팅하고 방송에 노출시킨다.",3
"눈앞에 펼쳐진 복도는 깜깜했어. 여성분이 602호를 찾아가 들어가자고 했지만, 나는 그때 약간 겁에 질린 상태였어. 인간은 어두운 곳을 본능적으로 무서워한다잖아. ...아닌가? 그러면 뭐, 나만 무서워한다고 하자.",3
예전에 중국 상황을 보고나서 그다음에 코로나가 정말 무서운거라고 생각하였다.,3
또 실증이 나버려서 역시 패션의 완성은 얼굴 이라고 생각했기때문이 다시 원점으로 돌아왔다. 또 한 30분간 진짜 열심히 찾아봤다.,3
당장 딸만 해도 토익 시험이 취소되었다며 불평이다,3
집에서 애 셋 뒷바리지를 하느라 본인에게는 돈 천원 쓰는게 아까워서 벌벌 떠는,3
"불만점을 말하자면 많이 나오겠지만, 그만두지 못하게 하는 것은 딱 하나. 사람.",3
"그리고 나선 체력 훈련 같을 것을했다. 아니, 체력 훈련 보다 더~ 힘들 것을 했다. 그래서  다리가 너~무~너~무~ 아프고 뭉친 근육을 안 쓰다가 갑자기 쓰니까  정~말~정말~ 힘들었다.",3
만약 다음에또본다면 시간을 좀 줄이는것을추천할거같다. 우리반애들도 거의다 지치고 심심해했던거같다.,3
