diary,emotion
"경의선 숲길에 처음 가봤다. 밤이었다. 어두워서 잘은 보이지 않았으나 철길 같은 것과 동상이 놓여져 있었다. 길이 넓고 평평해서 걷기 좋았다. 분위기도 마음에 들어서 가끔 와야겠다고 생각했다. 자전거가 있었다면 자전거를 타도 좋았을 텐데, 이사를 오면서 가져오지 못했다. 혼자 사는 집은 좁고 복도도 없어서 자전거를 세워 놓을 공간이 마땅치 않기 때문이다. 오랜만에 낯선 길을 걷고 있으니 여행하는 기분이 들었다. 몇 년 전에 일본 여행을 갔을 때도 밤이면 이렇게 모르는 길을 따라서 산책을 했었다. 도시 어디에나 강이 흘러서 신기했던 기억이 난다.",1
또 우울한 나를 위해 나 자신이 이것저것 맛있는 거 좋아하는 거 먹이려고 향하는 게 너무 고마웠다. 아무도 말해봤자 내 말에 관심이 없을 거라고 생각하고 그랬는데 진짜같이 있어 주는 건 나 자신밖에 없다는 생각을 하니까 한결 나아졌고 실패도 별거 아니라는 생각이 들었다. 사실 실패를 할 바엔 차라리 도전하지 않는 것이 내 철학? 이었는데  이렇게 나 자신이 같이 있어 준다면 그다지 두려울 것도 없을 거 같다 실패해도 나는 나니까 괜찮다 어찌 되든 상관이 없다 두려움에 맞서는 나 자신이 되어야지 담대해져야지 사실 자격증시험 보기 전에 모의고사를 봤는데 점수가 정말 턱없이 부족해서 그냥 가지 않았다. 이것도 도망친 걸까? 그렇다고 봐도 상관없다,1
6. 원하는 물건 사줄때,1
지금 옆에서 코 골고 자는데 간만에 나랑 같이 자줘서 엄청 뿌듯하다,1
또볼꺼같아요.,1
너무 이쁘당~,1
현실에 만족하고 감사하며 많이 깔깔 웃으며,1
조식도 가지수는 적지만 맛있고 수영장도 깊이 딱 넓이 딱 완전 내 취향저격 탕탕이다ㅠㅠ,1
오늘 점심은 뭐먹지 생각만해도 너무좋아 마라탕이 먹고싶다. 배달시키고 싶다,1
몇주일후 그 환자가 다른 병동에서 퇴원했다는 소식을 듣게 되었고 사막같던 마음에 기쁨이 가득찼다.,1
오늘은 평소와 달리 유난히 기분이 좋았다. 엄마를 만났기 때문이다. 그래서 엄마와 영원히 같이 있고 싶어서 엄마를 따라갔다. 오늘은 좋은 날이다.,1
주는 생각만 해도 행복해.,1
"도서관에서 공부하다 벗꽃이 필때면 점심먹으러 나가서 강가로 내려가 벗꽃구경도 하기도 했고,",1
시험 준비하면서 객관적인 불어 실력도 많이 늘었고(진작 저학년때 좀 할걸),1
조금 고됫지만 다 하고나니 털이 빵실빵실해진 비숑이 너무 귀여_고 보람찼다 누렇던 털 색깔도 엄청 하얘지고 아얘 다른 강아지처럼 보일정도였다 하지만 최대한 꼼꼼히 햇음에도 미처 다 펴지지못한 털도잇엇다 아쉽지만 처음 해본거기 때문에 다음엔 더 잘할수 있을꺼 같다.비숑은 사랑이다.,1
동생은 자기가그린것은 안했다 왜냐면... 엄마가 그것도 어려워서 않했다. 그데신 엄마가 그리 꽃을 색칠했다. 엄마는 상상에 꽃을 색칠하고 주한 튤립을 색칠했다. 오늘 이걸 (이글을) 쓸때 이런생각했다. 만약에 내친구가 이걸 쓴다면 글씨를크게 써서한~~~.......... 10장? 5섯장?아니다 한 11 정도 되겠다! 한줄에 5섯개 (갯주가) 정도 밖게 않되잖아-ㅅ- 나는 이걸 (이글을) 쓸때 힘들긴 했지만 재미있다. (이제 3줄 아니 2줄 남았녜ㅠㅠ) (얼룽 쓰고 밖게 나가거나 놀아야지! 아~ 끝났네^_^),1
오늘 태풍때문에 바람이 불고 비가 와서 못 나갈줄 알았는데 엄마랑 반주하러 성당에 같이 갔다. 바람이 조금 불었는데도 우산이 뒤집어져서 누나랑 웃었다. 태풍바람은 다른거 같다. 태풍일때는 조심해야겠다.,1
무엇보다 이상적이었던 것은 방언을 우리에게 '선생'으로서 가르친다는 당신의 역할을 아주 잘 이해하고 있었다는 점이다. 그래서 학생들이 별 힘을 들이지 않고도 조사를 수월하게 할 수 있었다.,1
지금까지 보육 실습과 교육 실습을 진행하며 스스로 생각한 교육관을 돌아보고 확립 할 수 있는 계기가 있었다.,1
그런 기억들을 안고 성공을 쟁취함으로써 기쁨보단 더이상 그런 슬픔을 겪지 않아도 된다는 안도감으로 나의 마음이 채워져갔다. 아마 나의 곁에서 지켜본 가까운 사람들도 같은 마음이였을거라 생각된다.,1
나는 카레를  굉장히 좋아한다. 얼마나 좋아하냐면 카레를 한번 끓이면 한솥 끓여 아침 점심 저녁 에 카레를 이틀동안 끓여먹는다. 그 카레로 돈까스 카레를 먹기도 하고 카레 스프를 끓여먹기도 하고 드라이 카레를 먹기도 하고 카레는 무궁무진하고 맛있다.,1
그리고 꾸준히 저와 함께해준 인연들도 항상 너무 고맙고. 앞으로 주변사람들을 더 소중히 하는 제가 될테니 내년도 내후년에도 함께해주세요,1
빈쵸 상히츠마부시 먹었는데 어우 너무너무 맛있었다!,1
집에서 겨울왕국 2편을 봤는데 아주 재미있었다. 노래도 좋았다.,1
나는 오늘 독서 통 장목표를 달성했다. 기분이날듯이좋았다. 다음엔 책 을 더많이 읽고싶다. 목표달성한게기분이 너무너무좋았다. 그리고게휙도만들었 다. 오늘기분이 너무좋았다. 다음에 더 더 책읽 어야 겠다.,1
"셋째, 위생을 준수하며 안전한 환경을 가장 우선시 하는 교사이다. 발달에 앞서 건강한 신체를 지녀야만 모든 영역에서 건강한 발달이 가능하다고 생각하기 때문에 위생과 건강을 첫 번째로 생각하는 것이 중요하다고 생각한다.",1
나는 오늘 스타워즈 영화를 봤다. 2020.1.8 개봉한 거다. 싸우는 장면도 재밌었고 다 재밌었다.,1
비록 나는 중국어를 하나도 못알아듣지만 설명하는 분을 친구와 쫄랑쫄랑 따라다녔다. 바다도 보고 불상도 보는 좋은 경험이었다.,1
충분히 행복했던 자유 여행이었고 나 스스로도 단단해지는 일정이었다,1
"통인시장은 엽전이랑 도시락을 5,000원으로 사고 그 엽전을 사용해서 음식을 도시락에 담는곳 이다 우린 3명이라 엄청 다양하게 샀다. 그 음식은 다 너무맛있었다. 특히 기름떡볶이가 맛있었다.",1
정말 재미있었던 하루였다.,1
그리고 계곡으로 놀러감 갤노트 좋다 졸라 햄보케 ㅋㅋㅋ 아는 삼촌껄루 사진 찍었다능 ㅎㅎ,1
제목은 ‘괴물메기를 물리친 소’였다.그 이야기를 들은 다음 2층으로 올라갔다. 그리고 영화관에 갔다. 그런데 영화갔지 않았다. 너무 재미없었다.(횡성 한우의 비결 법이었다.)그 다음에 운전 게임을 했다. 그리고 윷놀이 도 했다. 그다음 3층으로 올라가서 스티커를 뽑 았다. 그림을 색칠해서 기계에 찍으면 스티커가 나왔다. 신기했다.,1
산에 갔다. 산에서 막대기로 장난 쳤는데 정말 재미있었다. 또 줄넘기도 했다. 산길을 걷다가 토끼도 만났다.,1
다음 생일이 빨리 오면 좋겠고 나아주신 부모님이 감사하다.,1
무슨 내용인지도 모르고 읽기 시작했는데 생각보다 재미있더라고요. 그래서 읽어보게 됐어요.,1
1~5라운드 내내 너무 재미있었고 대회 뛰는 기켄의 모습을 볼 수 있어서 너무 좋았던 것 같다. 구터스는  최종 3위로 패자부활전에 가지않고  바로  결승진출을  했다. 결승 확정을 짓고나서 기켄의 모습을 봤는데 정말 좋아하는게 눈에 보였어서 더 행복했던 것 같다.,1
물어보기도 했었다 그 덕분일까 성적도 괜찮게 나왔고 무사히 2학년으로 올라왔었고 교수님들이 날 기억해줘서,1
⑨저는 내 부모님과 선생님도 좋아합니다.,1
"위 문제점을 해결하면, 이전에 내가 언급했던 유기견 입양 및 애견 미용실이 되는 것이다. 누구와 완전히 다른 아이디어가 아닌, 그저 관점이 반려견에게 맞춘 것으로 시작하기로 하였다. 펫샵, 미용샵의 주 수입은 반려견을 판매하는 것이다. 하지만 이는 개농장에서 구해오는 것에다가 반려동물의 권리, 그리고 생명을 사고 파는 것에 대한 존엄성 문제 또한 생긴다. 나는 이러한 것에서 불만을 가졌으며, 반려동물을 판매하는 것이 아닌 유기견을 보호하며 입양을 도와주는 곳이 되어주고 싶었다. 사람들은 유기견을 더럽고 위험하다고 생각하는 그 편견을 깨트리고, 개농장의 악순환 또한 없애고 싶었다. 미용샵이자 유기견 보호소가 되며, 동시에 입양소가 되는 것. 아무래도 다 좋았다. 내 현재 전공인 애견 미용과 일반적인 펫샵과는 다른 아이디어, 그리고 유기묘/유기견에게도 좋은 안식처가 될 수도 있기에 더욱 효과적이라고 생각한다.",1
함께 하는 취미가 있는 공동체에 들어온 느낌이라서 너무 좋다..,1
오늘은 신곡교회에 갔다. 투호를 했는데 화살 5개를 주었다. 4개를 넣었다. 기분이 좋아 펄쩍 뛰었다. 스티커를 받아서 돌림판을 돌렸다. 계속1번만 나와서 페브리즈를 2개 나오고 5번 쥐포가 나왔다. 쥐포랑 맥주먹고 우리는 축구했다. 정말 재미있었다. 다음에 또 가고 싶다.,1
그다음엔 보이스카우트에 갔다. 나는 보이스카우트가 '쓰레기 줍는 단체'인줄 알았다. 그런데 가보니 재밌는거 천지였다.,1
학교 숙제로 노래 가사를 만들었다. 유명한 동요의 멜로디에 ‘화산 분출에 관한 내용을 노래로 만들었다. 어려웠지만 엄마의 도움으로 할수있었다.그리고 화산분출 대해 알아볼수 있었던 좋은 기회였다. 어려운 숙제를 마치고 나니 뿌듯했다.,1
그냥 오늘도 적당히 ' 아 오늘 하루도 감사하고 행복했네' 싶도록 잘 살아야 겠다.,1
그러니까 나는 이 아이들을 모두 그대로 사랑하고 좋아하는 데,1
누구나 그러 했듯이 젊은 날에는,1
"나는 잘난척 하는 친구는 싫고 공감을 잘 하는 친구가 좋다. 또 질투를 잘 하는 친구는 싫고 잘 노는 친구는 좋다. 그런데 내가 자만하고 잘난척하는 것 같아서 고쳐야 겠다고, 생각 했다. 그다음 제일 좋아하는 친구는 잘못했으면 먼저 사과하고 편하게 잘 대화할 수 있는 친구가 가장 좋다. 그런 으미에서 나도 먼저 사과하고 편하게 대화를 잘 할 수 있는 친구가 되려고 노력을 해야겠다.",1
"2) 영감을 주는 뮤즈이자,",1
동생 시아와 집을 지었다. 이불을 깔고 의자를 논 다음에 의자 위에 매트를 깔았다. 그안에 장식도 했다. 그안에서 보드게임을 동생과 했다. 정말 재밌었다. 다음에 또 만들고 싶다.,1
오빠꺼랑 내꺼 _다. 오빠는 코난 재로의 집팽인 보고나는 신비 아파트 요르문 간드대 하늘 도깨비 _다 둘 다 재밌었다. 게임도 했다. 숙제 다 해서 2시간 하게 해줬다.,1
친척들과 갈비집에 갔다. 갈비는 양년갈비를 먹었는데 양념이 달콤해서 맛있었다. 그리고 놀이방도 있어서 재미있게 놀았다. 다음에 또 오고싶다. 갈비를 다 먹고 편의점에 갔다. 엄마가 간식을 사주셔서 감사했다.,1
내가 이콘서트를보았을 때 느낀점은 곡중에는 운명이 가장 마음이들었다 왜냐면가장웅장해서인것 같다. 그리고 베토벤이 표현한 운명이 문을 두드리는 소리는 내가생각하기에는 인생이 험난해서 주저앉을때 뭔가교훈을 주기위해 나는소리 같다 그래서 웅장하고 크게 만든음악 갔다 나는그런 웅장한노래가 부드러운 노래나 시끄러 운노래보다훨씬좋다.,1
5. 칭찬 받았을,1
조금 고됫지만 다 하고나니 털이 빵실빵실해진 비숑이 너무 귀여_고 보람찼다 누렇던 털 색깔도 엄청 하얘지고 아얘 다른 강아지처럼 보일정도였다 하지만 최대한 꼼꼼히 햇음에도 미처 다 펴지지못한 털도잇엇다 아쉽지만 처음 해본거기 때문에 다음엔 더 잘할수 있을꺼 같다.비숑은 사랑이다.,1
가족들도 축하해주었다. 함께 지냈던 모든 분들이 제 일처럼 기뻐해주셨다. 함께 기쁨을 나눌 수 있는 사람들이 있어 좋았다. 물론 함께 기쁨을 나누지 못한 아쉬운 사람들도 있었다. 같은 결과를 내지 못해 나또한 아쉬웠지만 당사자는 얼마나 더 힘들까 싶다. 나도 그 힘듦을 아니까.,1
오늘은 성탄절. 뭐 다른 애들은 크리스마스라고 부모님께 선물 사달라고 조르거나 산타할아버지를 손꼽아 기다리겠지만 우리 가족의 성탄절은 해마다 같다. 먼저 예수님의 생신을 축하드리는 예배를 드리고 아빠의 친구들을 만나 맛있는 저녁을 먹는다. 그나마 이번엔 조금 평범하지 않았던 것 같다. 사업에 성공하여 부자가 되어 60층 넘게 높은 아파트에 사는 부자친구 집에 놀러갔다. 엘리베이터 올라가는데 침을 꼴딱꼴딱 삼키지 않으면 귀가 멍멍해질 정도로 높았다. 맛있는 오리고기를 먹었다. 그리고 그 오리고기집에 있는 놀이방에 추억의 오락 게임이 있었다. 격투게임은 역시 내가 최고였다. 똑같지만 재미있는 하루였다.,1
늦지 않았길 바라며 모든 대한민국 사람들 건강하고 행복했으면 한다. 이만 안녕,1
"캠핑장에 갈때 옷을 2겹이나 입고 갔다. 캠핑장에 도착했을때 들어가는 입구가 빙판으로 되여있었다. 그래서 차 바퀴가 헛돌았다. 탠트를 다 첬을 때 빙판을 가장자리에서 빙판을 깼다. 하얀색 부분이 잘 깨졌다. 탠트쪽에서 내려가다보면 행사하는 대가 있다. 거기에서 코크르마개 총으로 장난감 사슴을 마추는 걸 했다. 그런데 난 사슴을 못 맞추었다. 못 맞췄서 슬펐다. 다음날 숨은그림찼기를 14개나 했다. 어려운 거는 아빠, 엄마와 같이 풀었다. 숨은 그림찼기는 다음날 밤에 끝났다. 팠콘을 튀겨서 _있게 먹었다. 튀길때 종이를 넣었더니 톡톡 터졌다. 그래서 좋았다. 쌍용어드벤처 캠핑장에 많이 오고 싶다.",1
나는 이렇게 지낼것이고 앞으로도 이렇게 사소하지만 행복이 지속되기를 바란다.,1
오늘은 과자파티가 있는 날이다. 그런데 나는 오늘 과자파티가 있는 줄 몰랐다. 그래서 과자를 안 가져온 것이다. 왜 오늘 과자파티가 있는 줄 몰랐냐면 어제 했던 라면파티가 과자파티보다 중요하게 생각해서 그런 것이다. 그래서 앞으로 준비물은 그냥 칠판에 쓰여 있어도 알림장에 적어야겠다. 그리고 내가 과자를 안 가져왔는데도 초코칩쿠키를 나누어 주신 선생님이 정말 고마웠다. 앞으로 칠판에 쓰여 있는 것 말고도 선생님께서 말씀하시는 것도 꼼꼼하게 적으면 나에게 큰 도움이 될 것 같다.,1
누군가에게 안기고 싶고 의지하고 싶다,1
근데 나는 그렇게 돈이 아깝지않았다,1
내가원하는 안경을 써볼수 있어서 참   좋았다. 여덟번째 자동차정비체험,1
요즘 세상이 많이 좋아졌다. 계약을 핸드폰으로도 할 수 있네ㅎㅎㅎ 신기하다,1
"나는 어제 친구들과 축구를했다. 나는 친구들과 고등학교 운동장에서 만나서 축구를했다. 처음에 승부차기라는 축구를했다 승부차기는 친구두명이 골끼,공차기 역할을나누어 하는것인데 나는 처음에 골끼가되어 공을막았다. 친구가 다섯번을 찼는데 내가 3번을막고 2번을 골을 먹혔다. 다음은 내가 공을 찼는데 3번을 넣고2번은 빗 나갔다. 그래서 내가 1번차이로 이겨서 좋았다.",1
또 우울한 나를 위해 나 자신이 이것저것 맛있는 거 좋아하는 거 먹이려고 향하는 게 너무 고마웠다. 아무도 말해봤자 내 말에 관심이 없을 거라고 생각하고 그랬는데 진짜같이 있어 주는 건 나 자신밖에 없다는 생각을 하니까 한결 나아졌고 실패도 별거 아니라는 생각이 들었다. 사실 실패를 할 바엔 차라리 도전하지 않는 것이 내 철학? 이었는데  이렇게 나 자신이 같이 있어 준다면 그다지 두려울 것도 없을 거 같다 실패해도 나는 나니까 괜찮다 어찌 되든 상관이 없다 두려움에 맞서는 나 자신이 되어야지 담대해져야지 사실 자격증시험 보기 전에 모의고사를 봤는데 점수가 정말 턱없이 부족해서 그냥 가지 않았다. 이것도 도망친 걸까? 그렇다고 봐도 상관없다,1
친구들과 보드게임방에 갔다. 야구게임이 제일 재미 있었다.내가 홈런을 했다. 기분이 좋았다.마리오 게임도 재미있었다.,1
"네가 안겨주는 온기, 네 두눈의 끔벅거림. 한 번씩 다가와서 부리는 정겨운 애교짓. 나는 너를 포기 안해.",1
"엄마 오늘 어디 가는 거예요? 나는 물었다. 오늘은 뒷산에 갈 거란다. 엄마가 말씀하셨다. 토요일 우리는 집에서 점심을 먹은 뒤 차를 타고 보건소 옆에 있는 산으로 향했다. 차를 타고 가는 길에 높고 큰 돌(절벽)에 오르는 사람들이 보였다. 주말이라 그런지 사람이 꽤 있었다. 산에 도착한 뒤 우리는 산에 오르기 시작했다. 마을 길을 따라서 걷는 중 옆에 도랑이 있었는데, 물 안에 다슬기가 많이 살고 있었다. 물이 맑아 주민들도 다슬기를 잡으러 가끔 온다고 엄마가 말씀하셨다. 어머니는 아버지와 함께 등산을 자주 하시는데 오늘은 일이 많으신 아버지 대신 내가 따라갔다. 다시 마을 길을 따라 걸어 올라가는데 점점 오르막길이 나오기 시작했다. 아직 추울 거로 생각했는데 생각보다 날씨가 따뜻했다. 올라가던 도중 밭이 하나 있었는데 엄마는 이곳이 예전에는 절이 있던 곳이라고 했다. 그래서 그런지 주변에 기와나 접시 조각이 엄청나게 많이 널브러져 있었다. 원래 절터는 총 2개가 있었는데 지금은 사실상 터도 거의 없어져 밭이나 묫자리로 쓰이고 있었다. 중간에 갈림길이 하나 나왔는데 엄마가 왼쪽으로 가자고 하셔서 왼쪽으로 올라가기 시작했다. 얼마나 갔을까 봐 등산로 사라지고 험한 산길이 나오기 시작했다. 오늘 목표는 산에 있는 조그마한 폭포를 보는 건데 엄마가 이쪽으로 가다 보면 나온다고 해서 그냥 쭉 올라갔다. 30분을 더 가니 물소리가 들려오기 시작했다. 그리고 조금 뒤 우리가 찾던 폭포가 나왔다. 폭포치고는 조그마한 크기였지만 내 눈에는 아주 멋져 보였다. 폭포를 지나니 다시 등산로가 나오기 시작했다. 폭포를 봤으니 우리는 등산로를 따라 다시 마을로 내려갔다. 산에서 내려온 뒤 차를 타고 바다 주변에 있는 공원으로 향했다. 가까이에 있어서 차로 10분 동안 가니 공원이 나왔다. 우리는 바닷가에 있는 오솔길을 따라 걷기 시작했다. 옆에서 들리는 바람 소리와 흔들리는 나무를 바라보며 걸었다. 끝에 다다랐을 때 우리는 해변으로 내려가 모래 위를 걸었다. 모래 위에는 조개 껍데기와 소라 껍데기가 많이 있었는데 엄마는 그중에 예쁜 것을 찾아 가방 주머니에 넣으셨는데, 집에 가져가서 화분을 꾸미신다고 하셨다. 조금 더 걸은 뒤 우리는 집으로 돌아왔다. 집에 돌아온 후 생각해 봤는데 하루를 알차게 보낸 것 같아 기분이 좋아졌다.",1
행복해진다,1
그리고 2020년이 된 지금 나는 그 언니와 아직도 친한 친구사이이다. 매일 카카오톡을 주고받으며 가벼운 일상이야기 드라마 영화 이야기같은걸 한다.아주 가끔 그 때 우리가 좋아했던 소설이야기도 한다. 여행약속을 잡고 여행을 가기도 한다. 인연이란것은 참 신기하다.,1
그래서 나는 영화 국제시장에게 별 4개를 주고 싶다!,1
파이팅!!!!,1
아빠와 목욕탕에 갔다. 가서 아빠등을 밀어드렸다. 끝나고 먹은 음료수는 꿀맛이었다. 혹시 꿀이들어있는건아닌가?,1
"전국 발도프르학교 5학년 아이들의 가장 큰 행사인 올림피아드 축제! 올해는 우리 학교에서  개최하게 되었습니다.  윗 학년에서 열렸던 올림피아드는 그저 사진으로만 봤기때문에 어떠할지 전혀 짐작도 안되는 상황에서 엄마, 아빠들은 경기에 필요한 의상, 운동 기구 등을 준비하느라 분주한 가을을 보냈습니다.  예비모임을 위해  본 행사 한달 전 전국 5학년 발도르프 학교 아이들이 한자리에 모였고 멀리서 오는 학생들을 위해서 우리는 홈스테이도 준비하였습니다.  첫째가 딸아이여서 저 멀리 전라도에서 온 여자 친구 3명이 하룻밤을 자게 됐는데 흥분하는 아이와는 달리, 엄마인 저는 왜 이렇게 신경쓸 일들이 많은지.. 없는 이불 다 끌어모아서 깨끗하게 빨고 집 구석구석 청소하고 혹시 못먹는 음식이 있을지 걱정하면서 이런저런 장보고 요리하고..  정신없는 하루를 보냈습니다. 생각보다 차가 막혀서 오후 늦게 올라온 아이들은 얼굴에 피곤함과 긴장감이 적절하게 섞인 얼굴로 부끄럽게 인사를 건냈고 저도 쑥쓰러워서 오히려 호들갑을 떨며 세명의 꼬마 숙녀 손님들을 맞이하였습니다. 아이들은 금방 친해져서 작은 일에도 까르르~ 웃음을 터뜨리고 그 나이대 여자아이들의 최대 관심사인 같은 반 남자친구들의 장난질에 대한 성토의 장을 마련하여 한참을  진지하게 이야기 나눴습니다. 밥이 입에 안맞은건지 아니면 피곤했던 건지 저녁밥을 많이 먹지는 않았지만 어디서 그런 체력이 나온건지 짧은 밤이 아쉬운 듯 12시까지 책보고  이야기 꽃을 피웠습니다. 새벽에도 일찍 일어나서 자리정리 싹하고 기다리는 예쁜 5학년 아이들! 피곤해서 예행연습을 어떻게 했을지 걱정입니다.  하루종일 운동장에서 뛰고  구르고! 하루를 잘 보낸 후 아쉬운 작별을 했습니다. 그러나 한달 후 본경기때 다시 만날것이기 때문에 아쉬운 마음은 잠시 접고 한달간 기쁜 마음으로 기다려볼까 합니다. 올림피아드 자체도 흥분과 즐거움의 순간이겠지만 올림피아드 참석을 위해 멀리서 온 다른 발도르프학교 아이들을 알게되고 하룻밤 함께 지낸 것이 더 기억에 남습니다. 같은 교육을 한다는 것 만으로도 한 식구같고 애뜻한 마음을 나눌 수 있어서 소중한 추억이 되었습니다.",1
오늘은 미술관을 갔다. 미술관 에는 흥미로운게 많았다. 내가 보기에 가장 흥미로운것은 물감을 담는쟁반이였다. 옜날 선조들은 오늘날과는 다르게 접시에 물감을 담아서 썼다고한다. 옛날 선조들은 불편하지 않은가 힘들지 않은가 궁금해진다. 오늘은 참신기하고 흥미로운날이다. 다음달이빨리되서또 가고싶다.,1
"1. 친구랑 놀때행복하다.왜냐하면 친구랑 밖에서뛰어놀고, 게임을하고,이야기를할수있으니까.",1
